{
  "@context": [
    "https://www.w3.org/ns/credentials/v2",
    "https://raw.githubusercontent.com/nfh-trust-labs/opencred-vc-schemas/main/schemas/business-entity/v1/context.jsonld"
  ],
  "id": "urn:uuid:00000000-0000-4000-8000-000000000001",
  "type": [
    "VerifiableCredential",
    "BusinessEntityCredential"
  ],
  "issuer": {
    "id": "did:web:issuer.example",
    "name": "Example Issuer"
  },
  "validFrom": "2026-04-08T00:00:00Z",
  "credentialSubject": {
    "id": "did:web:acme.example",
    "legalEntityIdentifier": "529900T8BM49AURSDO55",
    "legalName": "Acme Corporation",
    "legalForm": "LLC",
    "legalJurisdiction": "US",
    "registrationDate": "2015-06-15",
    "status": "active",
    "registeredAddress": {
      "streetAddress": "1 Innovation Way",
      "addressLocality": "Boston",
      "addressRegion": "MA",
      "postalCode": "02108",
      "addressCountry": "US"
    },
    "registrationNumber": "MA-LLC-2015-88421",
    "businessCategory": "62.01"
  }
}
